{"generated_at": "2026-10-25", "kind": "homepilot.inference", "kinds": {"chat": {"candidates": 186, "compatible": 156, "diversity": {"publishers": 8, "rows": 20, "top_publisher_share": 0.25}, "lists": {"likes": [{"created_at": "2025-01-20T03:46:07.000Z", "downloads": 1485789, "id": "deepseek-ai/DeepSeek-R1", "last_modified": "2025-03-27T04:01:59.000Z", "likes": 14410, "live_providers": ["novita"], "provider": "deepseek-ai", "provider_label": "DeepSeek", "score": 0.7924, "trending_score": 14.0}, {"created_at": "2024-07-18T08:56:00.000Z", "downloads": 4833514, "id": "meta-llama/Llama-3.1-8B-Instruct", "last_modified": "2024-09-25T17:00:57.000Z", "likes": 8599, "live_providers": ["deepinfra", "featherless-ai", "novita", "nscale"], "provider": "meta-llama", "provider_label": "Meta", "score": 0.8078, "trending_score": 50.0}, {"created_at": "2024-04-17T09:35:16.000Z", "downloads": 133144, "id": "meta-llama/Meta-Llama-3-8B", "last_modified": "2024-09-27T15:52:33.000Z", "likes": 6768, "live_providers": ["featherless-ai"], "provider": "meta-llama", "provider_label": "Meta", "score": 0.6915, "trending_score": 6.0}, {"created_at": "2026-04-22T06:04:45.000Z", "downloads": 360375, "id": "deepseek-ai/DeepSeek-V4-Pro", "last_modified": "2026-06-22T12:12:50.000Z", "likes": 5677, "live_providers": ["deepinfra", "featherless-ai", "novita"], "provider": "deepseek-ai", "provider_label": "DeepSeek", "score": 0.7773, "trending_score": 16.0}, {"created_at": "2024-04-17T09:35:12.000Z", "downloads": 340477, "id": "meta-llama/Meta-Llama-3-8B-Instruct", "last_modified": "2025-06-18T23:49:51.000Z", "likes": 5559, "live_providers": ["featherless-ai"], "provider": "meta-llama", "provider_label": "Meta", "score": 0.7906, "trending_score": 80.0}, {"created_at": "2025-08-04T22:33:06.000Z", "downloads": 2871750, "id": "openai/gpt-oss-120b", "last_modified": "2025-08-26T17:25:03.000Z", "likes": 5440, "live_providers": ["baseten", "cerebras", "deepinfra", "featherless-ai", "fireworks-ai", "groq", "novita", "nscale", "ovhcloud", "scaleway", "together"], "provider": "openai", "provider_label": "OpenAI", "score": 0.762, "trending_score": 17.0}, {"created_at": "2025-08-04T22:33:29.000Z", "downloads": 5766151, "id": "openai/gpt-oss-20b", "last_modified": "2025-08-26T17:25:47.000Z", "likes": 5218, "live_providers": ["deepinfra", "featherless-ai", "groq", "nscale", "ovhcloud"], "provider": "openai", "provider_label": "OpenAI", "score": 0.7699, "trending_score": 19.0}, {"created_at": "2026-06-16T07:39:20.000Z", "downloads": 298589, "id": "zai-org/GLM-5.2", "last_modified": "2026-09-01T11:36:01.000Z", "likes": 5185, "live_providers": ["baseten", "deepinfra", "featherless-ai", "novita", "scaleway", "together", "zai-org"], "provider": "zai-org", "provider_label": "Z.ai", "score": 0.7633, "trending_score": 9.0}, {"created_at": "2024-12-25T12:52:23.000Z", "downloads": 1431735, "id": "deepseek-ai/DeepSeek-V3", "last_modified": "2025-03-27T04:01:45.000Z", "likes": 4452, "live_providers": ["deepinfra"], "provider": "deepseek-ai", "provider_label": "DeepSeek", "score": 0.6805, "trending_score": 3.0}, {"created_at": "2023-09-20T13:03:50.000Z", "downloads": 355829, "id": "mistralai/Mistral-7B-v0.1", "last_modified": "2025-07-24T16:44:02.000Z", "likes": 4226, "live_providers": ["featherless-ai"], "provider": "mistralai", "provider_label": "Mistral AI", "score": 0.6488, "trending_score": 1.0}, {"created_at": "2026-07-31T07:30:24.000Z", "downloads": 4112191, "id": "deepseek-ai/DeepSeek-V4-Flash-0731", "last_modified": "2026-08-01T03:07:41.000Z", "likes": 4088, "live_providers": ["baseten", "deepinfra", "featherless-ai", "novita", "scaleway"], "provider": "deepseek-ai", "provider_label": "DeepSeek", "score": 0.7514, "trending_score": 5.0}, {"created_at": "2023-12-13T21:19:59.000Z", "downloads": 430490, "id": "microsoft/phi-2", "last_modified": "2025-12-08T11:35:44.000Z", "likes": 3531, "live_providers": ["featherless-ai"], "provider": "microsoft", "provider_label": "Microsoft", "score": 0.6852, "trending_score": 4.0}, {"created_at": "2025-03-24T09:28:22.000Z", "downloads": 631701, "id": "deepseek-ai/DeepSeek-V3-0324", "last_modified": "2025-03-27T04:01:53.000Z", "likes": 3223, "live_providers": ["deepinfra", "featherless-ai"], "provider": "deepseek-ai", "provider_label": "DeepSeek", "score": 0.6306, "trending_score": 1.0}, {"created_at": "2024-11-26T16:08:47.000Z", "downloads": 300174, "id": "meta-llama/Llama-3.3-70B-Instruct", "last_modified": "2024-12-21T18:28:01.000Z", "likes": 3162, "live_providers": ["featherless-ai", "novita", "ovhcloud", "scaleway"], "provider": "meta-llama", "provider_label": "Meta", "score": 0.6657, "trending_score": 7.0}, {"created_at": "2025-07-11T00:55:12.000Z", "downloads": 325113, "id": "moonshotai/Kimi-K2-Instruct", "last_modified": "2026-04-23T02:08:36.000Z", "likes": 3007, "live_providers": ["featherless-ai", "novita"], "provider": "moonshotai", "provider_label": "Moonshot AI", "score": 0.6575, "trending_score": 1.0}, {"created_at": "2025-03-05T14:16:59.000Z", "downloads": 34835, "id": "Qwen/QwQ-32B", "last_modified": "2025-03-11T12:15:48.000Z", "likes": 2970, "live_providers": ["featherless-ai"], "provider": "qwen", "provider_label": "Qwen", "score": 0.5981, "trending_score": 1.0}, {"created_at": "2024-09-18T15:19:20.000Z", "downloads": 1106217, "id": "meta-llama/Llama-3.2-3B-Instruct", "last_modified": "2024-10-24T15:07:29.000Z", "likes": 2876, "live_providers": ["featherless-ai"], "provider": "meta-llama", "provider_label": "Meta", "score": 0.7171, "trending_score": 30.0}, {"created_at": "2024-09-18T15:03:14.000Z", "downloads": 534994, "id": "meta-llama/Llama-3.2-1B", "last_modified": "2024-10-24T15:08:03.000Z", "likes": 2718, "live_providers": ["featherless-ai"], "provider": "meta-llama", "provider_label": "Meta", "score": 0.6676, "trending_score": 9.0}, {"created_at": "2024-07-14T22:20:15.000Z", "downloads": 602534, "id": "meta-llama/Llama-3.1-8B", "last_modified": "2024-10-16T22:00:37.000Z", "likes": 2690, "live_providers": ["featherless-ai"], "provider": "meta-llama", "provider_label": "Meta", "score": 0.6795, "trending_score": 13.0}, {"created_at": "2025-05-28T09:46:42.000Z", "downloads": 161357, "id": "deepseek-ai/DeepSeek-R1-0528", "last_modified": "2025-05-29T11:37:44.000Z", "likes": 2490, "live_providers": ["deepinfra", "featherless-ai", "novita"], "provider": "deepseek-ai", "provider_label": "DeepSeek", "score": 0.5836, "trending_score": 0.0}], "newest": [{"created_at": "2026-10-13T11:16:41.000Z", "downloads": 4222, "id": "inclusionAI/Ling-3.1-flash", "last_modified": "2026-10-25T14:23:35.000Z", "likes": 150, "live_providers": ["novita"], "provider": "inclusionai", "provider_label": "inclusionAI", "score": 0.5767, "trending_score": 30.0}, {"created_at": "2026-10-10T04:32:18.000Z", "downloads": 3544, "id": "reflection/Beam-1.0-501B-A23B-NVFP4", "last_modified": "2026-10-21T21:21:29.000Z", "likes": 41, "live_providers": ["together"], "provider": "reflection", "provider_label": "reflection", "score": 0.4599, "trending_score": 8.0}, {"created_at": "2026-10-07T19:52:01.000Z", "downloads": 5510, "id": "reflection/Beam-1.0-501B-A23B", "last_modified": "2026-10-21T23:26:37.000Z", "likes": 259, "live_providers": ["baseten"], "provider": "reflection", "provider_label": "reflection", "score": 0.6517, "trending_score": 105.0}, {"created_at": "2026-09-23T18:00:57.000Z", "downloads": 4091, "id": "togethercomputer/Tev1-4B-experimental", "last_modified": "2026-09-23T23:09:21.000Z", "likes": 37, "live_providers": ["together"], "provider": "togethercomputer", "provider_label": "togethercomputer", "score": 0.3979, "trending_score": 1.0}, {"created_at": "2026-09-21T15:39:51.000Z", "downloads": 89572, "id": "XiaomiMiMo/MiMo-V2.6-Flash-RL", "last_modified": "2026-10-09T06:30:29.000Z", "likes": 582, "live_providers": ["novita"], "provider": "xiaomimimo", "provider_label": "XiaomiMiMo", "score": 0.6599, "trending_score": 18.0}, {"created_at": "2026-09-21T15:39:33.000Z", "downloads": 32525, "id": "XiaomiMiMo/MiMo-V2.6-Pro-RL", "last_modified": "2026-10-09T06:30:24.000Z", "likes": 778, "live_providers": ["novita"], "provider": "xiaomimimo", "provider_label": "XiaomiMiMo", "score": 0.6859, "trending_score": 32.0}, {"created_at": "2026-09-08T05:08:40.000Z", "downloads": 576, "id": "aisingapore/Nemotron-SEA-LION-v4.8-120B-A12B", "last_modified": "2026-10-19T07:26:06.000Z", "likes": 1, "live_providers": ["publicai"], "provider": "aisingapore", "provider_label": "aisingapore", "score": 0.1965, "trending_score": 0.0}, {"created_at": "2026-09-07T18:50:43.000Z", "downloads": 1390, "id": "AikidoSec/altar-1", "last_modified": "2026-09-20T12:21:04.000Z", "likes": 215, "live_providers": ["featherless-ai"], "provider": "aikidosec", "provider_label": "AikidoSec", "score": 0.4594, "trending_score": 0.0}, {"created_at": "2026-09-06T23:44:27.000Z", "downloads": 2931, "id": "medismera/Qwen3.8-27B-OBLITERATED-Mythos-Class-Agentic", "last_modified": "2026-10-13T19:28:15.000Z", "likes": 119, "live_providers": ["featherless-ai"], "provider": "medismera", "provider_label": "medismera", "score": 0.4943, "trending_score": 4.0}, {"created_at": "2026-09-04T07:48:00.000Z", "downloads": 97, "id": "cactopus/Omega_Sapphira_Joyous-L3.3-70B-v1.1", "last_modified": "2026-09-05T03:55:57.000Z", "likes": 1, "live_providers": ["featherless-ai"], "provider": "cactopus", "provider_label": "cactopus", "score": 0.172, "trending_score": 0.0}, {"created_at": "2026-09-03T06:09:53.000Z", "downloads": 1780, "id": "inclusionAI/Ling-3.0-flash-Fin", "last_modified": "2026-09-24T08:53:46.000Z", "likes": 128, "live_providers": ["novita"], "provider": "inclusionai", "provider_label": "inclusionAI", "score": 0.4581, "trending_score": 1.0}, {"created_at": "2026-09-02T03:29:33.000Z", "downloads": 102, "id": "cactopus/Omega-Sapphira-L3.3-70B-v1.3", "last_modified": "2026-09-05T20:16:03.000Z", "likes": 1, "live_providers": ["featherless-ai"], "provider": "cactopus", "provider_label": "cactopus", "score"